{"checks":[{"details":"Atomic rename works on same volume","name":"atomic_rename","status":"pass"},{"details":"Found claude at /usr/local/bin/claude","name":"claude_path","status":"pass"},{"details":"0.8.1","name":"claude_version","status":"pass"},{"details":"Configuration parsed and validated successfully","name":"config_parse","status":"pass"},{"details":"Runner mode: native (spawn claude directly)","name":"runner_selection","status":"pass"},{"details":".xchecker directory is writable","name":"write_permissions","status":"pass"},{"details":"WSL not installed or not available","name":"wsl_availability","status":"warn"},{"details":"Default WSL distro: Ubuntu-22.04","name":"wsl_default_distro","status":"pass"}],"emitted_at":"2025-01-01T00:00:00Z","ok":true,"schema_version":"1"}